{
  "report_version": "v1",
  "generated_at": "2026-03-31T03:37:57.867Z",
  "environment": {
    "service": "fto-backend-gin",
    "base_url": "http://127.0.0.1/fto/api",
    "notes": "auto-generated by scripts/generate_report_sample.mjs"
  },
  "baseline": {
    "name": "retrieval-baseline-v1",
    "k": 5,
    "weights": {
      "title": 4,
      "abstract": 2,
      "claim": 3,
      "keyword": 2,
      "fusion_lexical": 0.65,
      "fusion_semantic": 0.35
    },
    "recall_depth_rule": "max(6, k*3)",
    "data_snapshot": {
      "patents_jsonl": "6b081961d3075753e063a41649b6eec8d6e0c373996b514daaa286857a86b43a",
      "patents_json": "45ca841d0d3315f630bb45da6358fbd7641416f1ba5a3f3379e436d4c4c3b454",
      "queries_jsonl": "58469c66b455a27135afcacf311b040db4f13b8f3c7b5d686edf93a45b1043fb",
      "qrels_jsonl": "3ff5b5bd1d769c9c687a5b4a0eca4721bda5e42d93cbb745b186e6e3921cd064"
    }
  },
  "evaluation": {
    "queries": 5,
    "recall_at_k": 0.8333,
    "mrr_at_k": 1,
    "ndcg_at_k": 0.9459
  },
  "consistency_check": {
    "sample": 5,
    "seed": 20260331,
    "passed": 5,
    "failed": 0,
    "command": "node scripts/compare_online_offline.mjs --k 5 --sample 5 --seed 20260331 --base-url http://127.0.0.1/fto/api"
  },
  "query_report": {
    "query_id": "q1",
    "query": "无线充电 温控 线圈",
    "task_id": "task-1774928272993419898-24",
    "status": "succeeded",
    "created_at": "2026-03-31T03:37:52Z",
    "updated_at": "2026-03-31T03:37:57Z",
    "topk": [
      {
        "rank": 1,
        "patent_id": "CN202410001A",
        "patent_url": "https://patents.google.com/patent/CN202410001A",
        "title": "一种用于无线充电的温控结构",
        "risk_level": "high",
        "reason": "命中关键词: 无线充电, 无线充电 温控 线圈, 温控, 线圈；双路召回分 lexical=31 semantic=0.6281 fusion=1.0000；法律状态: 审中。"
      },
      {
        "rank": 2,
        "patent_id": "CN202355566A",
        "patent_url": "https://patents.google.com/patent/CN202355566A",
        "title": "一种电磁线圈屏蔽结构",
        "risk_level": "low",
        "reason": "命中关键词: 线圈；双路召回分 lexical=8 semantic=0.1715 fusion=0.2633；法律状态: 审中。"
      },
      {
        "rank": 3,
        "patent_id": "JP2023176543A",
        "patent_url": "https://patents.google.com/patent/JP2023176543A",
        "title": "充电底座热管理系统",
        "risk_level": "low",
        "reason": "命中关键词: (语义召回命中)；双路召回分 lexical=0 semantic=0.0884 fusion=0.0493；法律状态: 公开。"
      }
    ]
  }
}
